{
  "reviewed_at": "2025-07-02T14:05:00Z",
  "reviewed_by": {
    "name": "Priya Shah",
    "role": "H&S Manager",
    "organisation": "North Quay Care",
    "contact": {
      "email": "priya.shah@example.org",
      "phone": "+447700900123"
    }
  },
  "outcome": "amended",
  "summary": "Resident now uses a powered wheelchair and requests assistance to elevator lobby. Primary route updated to include evacuation lift E1; buddy arrangement confirmed.",
  "new_document_ref": {
    "document_type": "peep",
    "document_id": "peep_4f8a2c",
    "version": "v3.1",
    "uri": "https://app.example.org/peeps/peep_4f8a2c?v=3.1"
  },
  "next_due": "2026-01-02",
  "attachments": [
    {
      "label": "Training record \u2013 evac lift E1 (June 2025)"
    }
  ]
}